"Political parties and legislators use legislative debates to establish their reputation, challenge rivals, and engage in coalition management, among many other tasks. Yet, existing theories on parliamentary debates have abstracted away from the need for information and expertise, which are costly to acquire. Drawing on the 'informational' perspective on legislative organization, we address this problem by arguing that party leaders use committees as training arenas for their backbenchers. They task their assigned members with acquiring specific expertise and then rely heavily on those members during the corresponding debates. We turn to the Portuguese legislature, from 2000 to 2015, to discuss how saliency, government dynamics, and party size affect the use of experts. We test this theory using a novel approach to classify speeches that leverages the texts of legislation as training data for a supervised approach.
",1,"political parties and legislators use legislative debates to establish their reputation, challenge rivals, and engage in coalition management, among many other tasks. yet, existing theories on parliamentary debates have abstracted away from the need for information and expertise, which are costly to acquire. drawing on the 'informational' perspective on legislative organization, we address this problem by arguing that party leaders use committees as training arenas for their backbenchers. they task their assigned members with acquiring specific expertise and then rely heavily on those members during the corresponding debates. we turn to the portuguese legislature, from 2000 to 2015, to discuss how saliency, government dynamics, and party size affect the use of experts. we test this theory using a novel approach to classify speeches that leverages the texts of legislation as training data for a supervised approach.
",J,"Fernandes, JM; Goplerud, M; Won, M",NA,NA,NA,"Fernandes, Jorge M.; Goplerud, Max; Won, Miguel",NA,NA,Legislative Bellwethers: The Role of Committee Membership in Parliamentary Debate,LEGISLATIVE STUDIES QUARTERLY,NA,NA,English,Article,NA,NA,NA,NA,NA,committees; legislative party groups; legislative organization; parliamentary speeches; Portugal,INFORMATION-TRANSMISSION; ELECTORAL SYSTEMS; POLITICAL-PARTIES; GOVERNMENT; INSTITUTIONS; ASSIGNMENTS; DELEGATION; DISSENT; GETS,"Political parties and legislators use legislative debates to establish their reputation, challenge rivals, and engage in coalition management, among many other tasks. Yet, existing theories on parliamentary debates have abstracted away from the need for information and expertise, which are costly to acquire. Drawing on the informational perspective on legislative organization, we address this problem by arguing that party leaders use committees as training arenas for their backbenchers. They task their assigned members with acquiring specific expertise and then rely heavily on those members during the corresponding debates. We turn to the Portuguese legislature, from 2000 to 2015, to discuss how saliency, government dynamics, and party size affect the use of experts. We test this theory using a novel approach to classify speeches that leverages the texts of legislation as training data for a supervised approach.","[Fernandes, Jorge M.] Univ Lisbon, Inst Social Sci, Ave Prof Anibal Bettencourt 9, Lisbon, Portugal; [Goplerud, Max] Harvard Univ, Dept Govt, 1737 Cambridge St, Cambridge, MA 02138 USA; [Won, Miguel] INESC ID, Rua Alves Redol 9, Lisbon, Portugal",NA,"Fernandes, JM (corresponding author), Univ Lisbon, Inst Social Sci, Ave Prof Anibal Bettencourt 9, Lisbon, Portugal.",jorge.fernandes@ics.ulisboa.pt; goplerud@g.harvard.edu; miguelwon@tecnico.ulisboa.pt,"Won, Miguel/R-1458-2017","Won, Miguel/0000-0003-0745-7452",NA,NA,NA,NA,56,2,2,0,5,WILEY,HOBOKEN,"111 RIVER ST, HOBOKEN 07030-5774, NJ USA",0362-9805,1939-9162,NA,LEGIS STUD QUART,Legis. Stud. Q.,MAY,2019,44,2,NA,NA,NA,NA,307,343,NA,10.1111/lsq.12226,http://dx.doi.org/10.1111/lsq.12226,NA,NA,37,Political Science,Social Science Citation Index (SSCI),Government & Law,HU6YV,NA,NA,NA,NA,2022-07-01,WOS:000465429100004,View Full Record in Web of Science,"political parties and legislators use legislative debates to establish their reputation, challenge rivals, and engage in coalition management, among many other tasks. yet, existing theories on parliamentary debates have abstracted away from the need for information and expertise, which are costly to acquire. drawing on the informational perspective on legislative organization, we address this problem by arguing that party leaders use committees as training arenas for their backbenchers. they task their assigned members with acquiring specific expertise and then rely heavily on those members during the corresponding debates. we turn to the portuguese legislature, from 2000 to 2015, to discuss how saliency, government dynamics, and party size affect the use of experts. we test this theory using a novel approach to classify speeches that leverages the texts of legislation as training data for a supervised approach."
"The digital transformation has had a profound impact on political communication. It has lowered the access barrier for actors to become publicly visible and reconfigured predominantly vertical flows of information into horizontal communication networks. Media-centric studies hold that these 'hybrid media systems' do not subvert the analogue order tout court, as the media still occupy a central role in selection and distribution processes. In contrast to this, social movement scholars interested in digital forms of mobilization show that civil society actors can directly engage their base and the wider public. Because of this focus, the status and role of the media in these connective efforts has remained largely neglected. This study extends the view of both media-centric and social movement research by asking how the media are included in civil society mobilization efforts online and what status and role they have. Analysing the online communication around the UK climate change debate over a 30-month period, we show that while the media account for a substantial amount of the actors in the networks generated by civil society actors and bloggers, they become more marginal with respect to the authority they command. Not only are they replaced by bloggers as focal points in these digital political communication ecologies, they become next to irrelevant in allocating visibility and attention to other actors. This has ambivalent consequences for democratic discourse, as online debates become more inclusive but also more fragmented, lacking common points of reference.
",0,"the digital transformation has had a profound impact on political communication. it has lowered the access barrier for actors to become publicly visible and reconfigured predominantly vertical flows of information into horizontal communication networks. media-centric studies hold that these 'hybrid media systems' do not subvert the analogue order tout court, as the media still occupy a central role in selection and distribution processes. in contrast to this, social movement scholars interested in digital forms of mobilization show that civil society actors can directly engage their base and the wider public. because of this focus, the status and role of the media in these connective efforts has remained largely neglected. this study extends the view of both media-centric and social movement research by asking how the media are included in civil society mobilization efforts online and what status and role they have. analysing the online communication around the uk climate change debate over a 30-month period, we show that while the media account for a substantial amount of the actors in the networks generated by civil society actors and bloggers, they become more marginal with respect to the authority they command. not only are they replaced by bloggers as focal points in these digital political communication ecologies, they become next to irrelevant in allocating visibility and attention to other actors. this has ambivalent consequences for democratic discourse, as online debates become more inclusive but also more fragmented, lacking common points of reference.
",J,"Haussler, T",NA,NA,NA,"Haussler, Thomas",NA,NA,"Civil society, the media and the Internet: changing roles and challenging authorities in digital political communication ecologies",INFORMATION COMMUNICATION & SOCIETY,NA,NA,English,Article,NA,NA,NA,NA,NA,Internet; blogs; civil society; authority; media hybridity,SOCIAL MEDIA; NEWS; MOVEMENT; TWITTER; MEDIATIZATION; NETWORKS; PROTEST; BRITISH; CYCLE; FORM,"The digital transformation has had a profound impact on political communication. It has lowered the access barrier for actors to become publicly visible and reconfigured predominantly vertical flows of information into horizontal communication networks. Media-centric studies hold that these 'hybrid media systems' do not subvert the analogue order tout court, as the media still occupy a central role in selection and distribution processes. In contrast to this, social movement scholars interested in digital forms of mobilization show that civil society actors can directly engage their base and the wider public. Because of this focus, the status and role of the media in these connective efforts has remained largely neglected. This study extends the view of both media-centric and social movement research by asking how the media are included in civil society mobilization efforts online and what status and role they have. Analysing the online communication around the UK climate change debate over a 30-month period, we show that while the media account for a substantial amount of the actors in the networks generated by civil society actors and bloggers, they become more marginal with respect to the authority they command. Not only are they replaced by bloggers as focal points in these digital political communication ecologies, they become next to irrelevant in allocating visibility and attention to other actors. This has ambivalent consequences for democratic discourse, as online debates become more inclusive but also more fragmented, lacking common points of reference.","[Haussler, Thomas] Univ Bern, Inst Commun & Media Studies, Fabrikstr 8, CH-3012 Bern, Switzerland",NA,"Haussler, T (corresponding author), Univ Bern, Inst Commun & Media Studies, Fabrikstr 8, CH-3012 Bern, Switzerland.",thomas.haeussler@ikmb.unibe.ch,NA,"Haussler, Thomas/0000-0001-6949-9135",Swiss National Science Foundation [100017E-135915]; Schweizerischer Nationalfonds zur Forderung der Wissenschaftlichen Forschung,Swiss National Science Foundation(Swiss National Science Foundation (SNSF)European Commission); Schweizerischer Nationalfonds zur Forderung der Wissenschaftlichen Forschung(Austrian Science Fund (FWF)),This work was supported by the Swiss National Science Foundation under grant number 100017E-135915. Schweizerischer Nationalfonds zur Forderung der Wissenschaftlichen Forschung.,NA,61,2,2,1,26,"ROUTLEDGE JOURNALS, TAYLOR & FRANCIS LTD",ABINGDON,"2-4 PARK SQUARE, MILTON PARK, ABINGDON OX14 4RN, OXON, ENGLAND",1369-118X,1468-4462,NA,INFORM COMMUN SOC,Info. Commun. Soc.,JUL 4,2021,24,9,NA,NA,NA,NA,1265,1282,NA,10.1080/1369118X.2019.1697338,http://dx.doi.org/10.1080/1369118X.2019.1697338,NA,DEC 2019,18,Communication; Sociology,Social Science Citation Index (SSCI),Communication; Sociology,SX0WA,NA,Green Published,NA,NA,2022-07-01,WOS:000502505500001,View Full Record in Web of Science,"the digital transformation has had a profound impact on political communication. it has lowered the access barrier for actors to become publicly visible and reconfigured predominantly vertical flows of information into horizontal communication networks. media-centric studies hold that these 'hybrid media systems' do not subvert the analogue order tout court, as the media still occupy a central role in selection and distribution processes. in contrast to this, social movement scholars interested in digital forms of mobilization show that civil society actors can directly engage their base and the wider public. because of this focus, the status and role of the media in these connective efforts has remained largely neglected. this study extends the view of both media-centric and social movement research by asking how the media are included in civil society mobilization efforts online and what status and role they have. analysing the online communication around the uk climate change debate over a 30-month period, we show that while the media account for a substantial amount of the actors in the networks generated by civil society actors and bloggers, they become more marginal with respect to the authority they command. not only are they replaced by bloggers as focal points in these digital political communication ecologies, they become next to irrelevant in allocating visibility and attention to other actors. this has ambivalent consequences for democratic discourse, as online debates become more inclusive but also more fragmented, lacking common points of reference."
"In the hybrid media system, many processes are reforming political communication: popularisation, disintermediation, personalisation, intimisation and of course populism. This study proposes an empirical definition of political communication style with the aim of identifying characteristics of the populist political communication style. Between 2015 and 2016, the Twitter timelines of the main political leaders in Italy were analysed for 16 months. Applying an MCA allowed us to identify two key factors that characterise the communication styles of leaders: (1) communication mode, comparing negative and positive; and (2) communicative focus, comparing personalisation and political/campaign. The intersection of these two factors resulted in four different political communication styles: Engaging', Intimate', Champion of the people' and Man of the street'. The latter two were clearly characterised by the presence of populist ideology fragments and traits, but were not strictly related to the leaders' ideological positions. This result supports the hypothesis that populist style is less and less connected to the right/left political cleavage, but rather the result of a varied combination of gradations that mix different individual aspects of the leader's political communication style.
",1,"in the hybrid media system, many processes are reforming political communication: popularisation, disintermediation, personalisation, intimisation and of course populism. this study proposes an empirical definition of political communication style with the aim of identifying characteristics of the populist political communication style. between 2015 and 2016, the twitter timelines of the main political leaders in italy were analysed for 16 months. applying an mca allowed us to identify two key factors that characterise the communication styles of leaders: (1) communication mode, comparing negative and positive; and (2) communicative focus, comparing personalisation and political/campaign. the intersection of these two factors resulted in four different political communication styles: engaging', intimate', champion of the people' and man of the street'. the latter two were clearly characterised by the presence of populist ideology fragments and traits, but were not strictly related to the leaders' ideological positions. this result supports the hypothesis that populist style is less and less connected to the right/left political cleavage, but rather the result of a varied combination of gradations that mix different individual aspects of the leader's political communication style.
",J,"Bracciale, R; Martella, A",NA,NA,NA,"Bracciale, Roberta; Martella, Antonio",NA,NA,Define the populist political communication style: the case of Italian political leaders on Twitter,INFORMATION COMMUNICATION & SOCIETY,NA,NA,English,Article,NA,NA,NA,NA,NA,Populism; political communication style; Twitter; political leaders; popularisation,RIGHT-WING POPULIST; MEDIA; OPPOSITION; CHALLENGE; DISCOURSE; DEMOCRACY; VOTERS; PEOPLE,"In the hybrid media system, many processes are reforming political communication: popularisation, disintermediation, personalisation, intimisation and of course populism. This study proposes an empirical definition of political communication style with the aim of identifying characteristics of the populist political communication style. Between 2015 and 2016, the Twitter timelines of the main political leaders in Italy were analysed for 16 months. Applying an MCA allowed us to identify two key factors that characterise the communication styles of leaders: (1) communication mode, comparing negative and positive; and (2) communicative focus, comparing personalisation and political/campaign. The intersection of these two factors resulted in four different political communication styles: Engaging', Intimate', Champion of the people' and Man of the street'. The latter two were clearly characterised by the presence of populist ideology fragments and traits, but were not strictly related to the leaders' ideological positions. This result supports the hypothesis that populist style is less and less connected to the right/left political cleavage, but rather the result of a varied combination of gradations that mix different individual aspects of the leader's political communication style.","[Bracciale, Roberta] Univ Pisa, Dept Polit Sci, Sociol New Media, Pisa, Italy; [Martella, Antonio] Univ Pisa, Dept Polit Sci, Polit Commun, Pisa, Italy",NA,"Bracciale, R (corresponding author), Univ Pisa, Dept Polit Sci, Via Serafini 3, I-56126 Pisa, Italy.",roberta.bracciale@unipi.it; antonio.martella@sp.unipi.it,"BRACCIALE, ROBERTA/AAQ-7921-2020","BRACCIALE, ROBERTA/0000-0002-7567-4785; Martella, Antonio/0000-0003-3378-1782",NA,NA,NA,NA,67,73,74,2,35,"ROUTLEDGE JOURNALS, TAYLOR & FRANCIS LTD",ABINGDON,"2-4 PARK SQUARE, MILTON PARK, ABINGDON OX14 4RN, OXON, ENGLAND",1369-118X,1468-4462,NA,INFORM COMMUN SOC,Info. Commun. Soc.,NA,2017,20,9,NA,NA,SI,NA,1310,1329,NA,10.1080/1369118X.2017.1328522,http://dx.doi.org/10.1080/1369118X.2017.1328522,NA,NA,20,Communication; Sociology,Social Science Citation Index (SSCI),Communication; Sociology,EY2CP,NA,NA,NA,NA,2022-07-01,WOS:000403776300003,View Full Record in Web of Science,"in the hybrid media system, many processes are reforming political communication: popularisation, disintermediation, personalisation, intimisation and of course populism. this study proposes an empirical definition of political communication style with the aim of identifying characteristics of the populist political communication style. between 2015 and 2016, the twitter timelines of the main political leaders in italy were analysed for 16 months. applying an mca allowed us to identify two key factors that characterise the communication styles of leaders: (1) communication mode, comparing negative and positive; and (2) communicative focus, comparing personalisation and political/campaign. the intersection of these two factors resulted in four different political communication styles: engaging', intimate', champion of the people' and man of the street'. the latter two were clearly characterised by the presence of populist ideology fragments and traits, but were not strictly related to the leaders' ideological positions. this result supports the hypothesis that populist style is less and less connected to the right/left political cleavage, but rather the result of a varied combination of gradations that mix different individual aspects of the leader's political communication style."
"In this paper, we seek to understand the contemporary power of the presidential 'bully pulpit'-the persuasive power of the nation's highest elected office-in a context of shifting patterns of mediation. We do so by examining a major social media communication platform (Twitter) for evidence of changes in public opinion before and after President Obama's high-profile statements on net neutrality in November 2014. This study includes novel and comprehensive data on the effects of a presidential announcement on public opinion. With social media playing a growing role in both electoral and policy discourse, this paper offers a methodological foundation for future studies in the changing nature of the presidential bully pulpit and the role of social media as a tool of mediation in political communication.
",1,"in this paper, we seek to understand the contemporary power of the presidential 'bully pulpit'-the persuasive power of the nation's highest elected office-in a context of shifting patterns of mediation. we do so by examining a major social media communication platform (twitter) for evidence of changes in public opinion before and after president obama's high-profile statements on net neutrality in november 2014. this study includes novel and comprehensive data on the effects of a presidential announcement on public opinion. with social media playing a growing role in both electoral and policy discourse, this paper offers a methodological foundation for future studies in the changing nature of the presidential bully pulpit and the role of social media as a tool of mediation in political communication.
",J,"Michael, G; Agur, C",NA,NA,NA,"Michael, Gabriel; Agur, Colin",NA,NA,"The Bully Pulpit, Social Media, and Public Opinion: A Big Data Approach",JOURNAL OF INFORMATION TECHNOLOGY & POLITICS,NA,NA,English,Article,NA,NA,NA,NA,NA,President; bully pulpit; social media; public opinion; twitter; machine learning; big data,TWITTER; CAMPAIGN; TWEETS; COMMUNICATION; ELECTIONS; SENTIMENT; POWER,"In this paper, we seek to understand the contemporary power of the presidential bully pulpit-the persuasive power of the nation's highest elected office-in a context of shifting patterns of mediation. We do so by examining a major social media communication platform (Twitter) for evidence of changes in public opinion before and after President Obama's high-profile statements on net neutrality in November 2014. This study includes novel and comprehensive data on the effects of a presidential announcement on public opinion. With social media playing a growing role in both electoral and policy discourse, this paper offers a methodological foundation for future studies in the changing nature of the presidential bully pulpit and the role of social media as a tool of mediation in political communication.","[Michael, Gabriel] Yale Law Sch, Informat Soc Project, New Haven, CT USA; [Agur, Colin] Univ Minnesota Twin Cities, Sch Journalism & Mass Commun, Minneapolis, MN 55455 USA",NA,"Agur, C (corresponding author), Univ Minnesota Twin Cities, Sch Journalism & Mass Commun, Minneapolis, MN 55455 USA.",cpagur@umn.edu,"Michael, Gabriel/ABE-5380-2021","Agur, Colin/0000-0003-0799-6691",Oscar M Ruebhausen Fund under Internal Yale Law School grant,Oscar M Ruebhausen Fund under Internal Yale Law School grant,This study was supported by Oscar M Ruebhausen Fund under Internal Yale Law School grant.,NA,69,2,2,2,20,"ROUTLEDGE JOURNALS, TAYLOR & FRANCIS LTD",ABINGDON,"2-4 PARK SQUARE, MILTON PARK, ABINGDON OX14 4RN, OXON, ENGLAND",1933-1681,1933-169X,NA,J INF TECHNOL POLITI,J. Inf. Technol. Politics,NA,2018,15,3,NA,NA,NA,NA,262,277,NA,10.1080/19331681.2018.1485604,http://dx.doi.org/10.1080/19331681.2018.1485604,NA,NA,16,Communication; Political Science,Social Science Citation Index (SSCI),Communication; Government & Law,GS5WM,NA,Green Published,NA,NA,2022-07-01,WOS:000443744000005,View Full Record in Web of Science,"in this paper, we seek to understand the contemporary power of the presidential bully pulpit-the persuasive power of the nation's highest elected office-in a context of shifting patterns of mediation. we do so by examining a major social media communication platform (twitter) for evidence of changes in public opinion before and after president obama's high-profile statements on net neutrality in november 2014. this study includes novel and comprehensive data on the effects of a presidential announcement on public opinion. with social media playing a growing role in both electoral and policy discourse, this paper offers a methodological foundation for future studies in the changing nature of the presidential bully pulpit and the role of social media as a tool of mediation in political communication."
