"This study investigates the overall topic compositions and traces of right-wing populist partisanship in the content structures of German-language digital alternative news outlets. We argue that a topically heterogeneous landscape of right-wing populist alternative news outlets could maximize the reach of right-wing populist messages. Using LDA topic modeling, we explore the topical structures of nine different outlets (n = 66,965 articles) and empirically identify meaningful groups of outlets. Our analyses suggest the existence of two topically heterogeneous clusters of alternative news media: (1) core right-wing populist outlets, with around 45-50% of articles coming from topics that are related to right-wing or populist politics; and (2) topically diverse outlets. The latter group's topic selection also reveals right-wing populist partisanship, but less prominently so, while putting more emphasis on general interest news topics, such as sports, economy, or international relations. This group also includes Russian state-owned RT deutsch and Falun Gong-affiliated Epoch Times whose institutional roots, however, are only partially reflected in their topic selection. Additionally, longitudinal analyses reveal an increase of populism-related topics in both groups around the election date of the 2017 German federal election.
",1,"this study investigates the overall topic compositions and traces of right-wing populist partisanship in the content structures of german-language digital alternative news outlets. we argue that a topically heterogeneous landscape of right-wing populist alternative news outlets could maximize the reach of right-wing populist messages. using lda topic modeling, we explore the topical structures of nine different outlets (n = 66,965 articles) and empirically identify meaningful groups of outlets. our analyses suggest the existence of two topically heterogeneous clusters of alternative news media: (1) core right-wing populist outlets, with around 45-50% of articles coming from topics that are related to right-wing or populist politics; and (2) topically diverse outlets. the latter group's topic selection also reveals right-wing populist partisanship, but less prominently so, while putting more emphasis on general interest news topics, such as sports, economy, or international relations. this group also includes russian state-owned rt deutsch and falun gong-affiliated epoch times whose institutional roots, however, are only partially reflected in their topic selection. additionally, longitudinal analyses reveal an increase of populism-related topics in both groups around the election date of the 2017 german federal election.
",J,"Muller, P; Freudenthaler, R",NA,NA,NA,"Mueller, Philipp; Freudenthaler, Rainer",NA,NA,"Right-Wing, Populist, Controlled by Foreign Powers? Topic Diversification and Partisanship in the Content Structures of German-Language Alternative Media",DIGITAL JOURNALISM,NA,NA,English,Article; Early Access,NA,NA,NA,NA,NA,Alternative media; right-wing populism; partisanship; topic modeling; content analysis; elections,SOCIAL MEDIA; POLITICAL COMMUNICATION; NEWS; INTERNET; COMPETITION; ATTITUDES; EXPOSURE; COVERAGE; FACEBOOK; PARTIES,"This study investigates the overall topic compositions and traces of right-wing populist partisanship in the content structures of German-language digital alternative news outlets. We argue that a topically heterogeneous landscape of right-wing populist alternative news outlets could maximize the reach of right-wing populist messages. Using LDA topic modeling, we explore the topical structures of nine different outlets (n = 66,965 articles) and empirically identify meaningful groups of outlets. Our analyses suggest the existence of two topically heterogeneous clusters of alternative news media: (1) core right-wing populist outlets, with around 45-50% of articles coming from topics that are related to right-wing or populist politics; and (2) topically diverse outlets. The latter group's topic selection also reveals right-wing populist partisanship, but less prominently so, while putting more emphasis on general interest news topics, such as sports, economy, or international relations. This group also includes Russian state-owned RT deutsch and Falun Gong-affiliated Epoch Times whose institutional roots, however, are only partially reflected in their topic selection. Additionally, longitudinal analyses reveal an increase of populism-related topics in both groups around the election date of the 2017 German federal election.","[Mueller, Philipp; Freudenthaler, Rainer] Univ Mannheim, Inst Media & Commun Res, Mannheim, Germany",NA,"Muller, P (corresponding author), Univ Mannheim, Inst Media & Commun Res, Mannheim, Germany.",p.mueller@uni-mannheim.de,NA,"Freudenthaler, Rainer/0000-0002-9075-1232; Muller, Philipp/0000-0002-5351-0608",NA,NA,NA,NA,69,0,0,0,0,"ROUTLEDGE JOURNALS, TAYLOR & FRANCIS LTD",ABINGDON,"2-4 PARK SQUARE, MILTON PARK, ABINGDON OX14 4RN, OXON, ENGLAND",2167-0811,2167-082X,NA,DIGIT JOURNAL,Digit. Journal.,NA,NA,NA,NA,NA,NA,NA,NA,NA,NA,NA,10.1080/21670811.2022.2058972,http://dx.doi.org/10.1080/21670811.2022.2058972,NA,MAR 2022,24,Communication,Social Science Citation Index (SSCI),Communication,0I2MM,NA,NA,NA,NA,2022-07-01,WOS:000779258800001,View Full Record in Web of Science,"this study investigates the overall topic compositions and traces of right-wing populist partisanship in the content structures of german-language digital alternative news outlets. we argue that a topically heterogeneous landscape of right-wing populist alternative news outlets could maximize the reach of right-wing populist messages. using lda topic modeling, we explore the topical structures of nine different outlets (n = 66,965 articles) and empirically identify meaningful groups of outlets. our analyses suggest the existence of two topically heterogeneous clusters of alternative news media: (1) core right-wing populist outlets, with around 45-50% of articles coming from topics that are related to right-wing or populist politics; and (2) topically diverse outlets. the latter group's topic selection also reveals right-wing populist partisanship, but less prominently so, while putting more emphasis on general interest news topics, such as sports, economy, or international relations. this group also includes russian state-owned rt deutsch and falun gong-affiliated epoch times whose institutional roots, however, are only partially reflected in their topic selection. additionally, longitudinal analyses reveal an increase of populism-related topics in both groups around the election date of the 2017 german federal election."
"This article examines the sources of ideological skepticism about two issues where there is a scientific consensus: climate change and evolution. The results indicate that self-identified conservatives doubt global warming in large part because of elite rhetoric, but that evolution beliefs are unrelated to reception of political discourse. News reception is perhaps the strongest predictor of conservatives' climate change skepticism, but has no influence on their aversion to evolution. Moreover, the article leverages three sources of variation in elite discourse on climate changetemporal, cross-national, and experimentalto show that changes in the prevalence of ideological cues strongly affect public opinion about global warming. Politically attentive conservatives, in fact, were more likely to believe scientists about global warming than liberals were in the 1990s before the media depicted climate change as a partisan issue. The United States is also the only nation where political interest significantly predicts both conservatives' skepticism about, and liberals' belief in, climate change. Finally, evidence from a national survey experiment suggests that Americans would be less skeptical of manmade global warming if more Republicans in Congress believed in it, but a growing Congressional consensus about evolution would not diminish doubts about its existence.
",0,"this article examines the sources of ideological skepticism about two issues where there is a scientific consensus: climate change and evolution. the results indicate that self-identified conservatives doubt global warming in large part because of elite rhetoric, but that evolution beliefs are unrelated to reception of political discourse. news reception is perhaps the strongest predictor of conservatives' climate change skepticism, but has no influence on their aversion to evolution. moreover, the article leverages three sources of variation in elite discourse on climate changetemporal, cross-national, and experimentalto show that changes in the prevalence of ideological cues strongly affect public opinion about global warming. politically attentive conservatives, in fact, were more likely to believe scientists about global warming than liberals were in the 1990s before the media depicted climate change as a partisan issue. the united states is also the only nation where political interest significantly predicts both conservatives' skepticism about, and liberals' belief in, climate change. finally, evidence from a national survey experiment suggests that americans would be less skeptical of manmade global warming if more republicans in congress believed in it, but a growing congressional consensus about evolution would not diminish doubts about its existence.
",J,"Tesler, M",NA,NA,NA,"Tesler, Michael",NA,NA,Elite Domination of Public Doubts About Climate Change (Not Evolution),POLITICAL COMMUNICATION,NA,NA,English,Article,NA,NA,NA,NA,NA,Climate change; evolution; elite domination; opinion change,POLICY PREFERENCES; NEWS; ORIGINS; RISK; POLARIZATION; PERCEPTIONS; ENVIRONMENT; ATTITUDES; OPINIONS; POLITICS,"This article examines the sources of ideological skepticism about two issues where there is a scientific consensus: climate change and evolution. The results indicate that self-identified conservatives doubt global warming in large part because of elite rhetoric, but that evolution beliefs are unrelated to reception of political discourse. News reception is perhaps the strongest predictor of conservatives' climate change skepticism, but has no influence on their aversion to evolution. Moreover, the article leverages three sources of variation in elite discourse on climate changetemporal, cross-national, and experimentalto show that changes in the prevalence of ideological cues strongly affect public opinion about global warming. Politically attentive conservatives, in fact, were more likely to believe scientists about global warming than liberals were in the 1990s before the media depicted climate change as a partisan issue. The United States is also the only nation where political interest significantly predicts both conservatives' skepticism about, and liberals' belief in, climate change. Finally, evidence from a national survey experiment suggests that Americans would be less skeptical of manmade global warming if more Republicans in Congress believed in it, but a growing Congressional consensus about evolution would not diminish doubts about its existence.","[Tesler, Michael] Univ Calif Irvine, Polit Sci, 3151 Social Sci Plaza, Irvine, CA 92697 USA",NA,"Tesler, M (corresponding author), Univ Calif Irvine, Polit Sci, 3151 Social Sci Plaza, Irvine, CA 92697 USA.",mtesler@uci.edu,NA,NA,NA,NA,NA,NA,54,44,44,3,31,TAYLOR & FRANCIS INC,PHILADELPHIA,"530 WALNUT STREET, STE 850, PHILADELPHIA, PA 19106 USA",1058-4609,1091-7675,NA,POLIT COMMUN,Polit. Commun.,NA,2018,35,2,NA,NA,NA,NA,306,326,NA,10.1080/10584609.2017.1380092,http://dx.doi.org/10.1080/10584609.2017.1380092,NA,NA,21,Communication; Political Science,Social Science Citation Index (SSCI),Communication; Government & Law,FZ9AO,NA,NA,NA,NA,2022-07-01,WOS:000427902200008,View Full Record in Web of Science,"this article examines the sources of ideological skepticism about two issues where there is a scientific consensus: climate change and evolution. the results indicate that self-identified conservatives doubt global warming in large part because of elite rhetoric, but that evolution beliefs are unrelated to reception of political discourse. news reception is perhaps the strongest predictor of conservatives' climate change skepticism, but has no influence on their aversion to evolution. moreover, the article leverages three sources of variation in elite discourse on climate changetemporal, cross-national, and experimentalto show that changes in the prevalence of ideological cues strongly affect public opinion about global warming. politically attentive conservatives, in fact, were more likely to believe scientists about global warming than liberals were in the 1990s before the media depicted climate change as a partisan issue. the united states is also the only nation where political interest significantly predicts both conservatives' skepticism about, and liberals' belief in, climate change. finally, evidence from a national survey experiment suggests that americans would be less skeptical of manmade global warming if more republicans in congress believed in it, but a growing congressional consensus about evolution would not diminish doubts about its existence."
"Existing studies focusing on politicians' adoption of Twitter have found that they use it primarily as a broadcasting tool. We argue that citizens' impolite and/or uncivil behavior is one possible explanation for such decisions. Social media conversations are rife with harassment and politicians are a prime target. This alters the incentive structure of engaging in dialogue on social media. We use Spanish, Greek, German, and U.K. candidates' tweets sent during the run-up to the recent European Parliament elections, and rely on automated text analysis and machine learning methods to measure their level of civility. Our contribution is an actor-oriented theory of political dialogue that incorporates Twitter's specific affordances, clarifying how and why Twitter's democratic promise may be limited.
",1,"existing studies focusing on politicians' adoption of twitter have found that they use it primarily as a broadcasting tool. we argue that citizens' impolite and/or uncivil behavior is one possible explanation for such decisions. social media conversations are rife with harassment and politicians are a prime target. this alters the incentive structure of engaging in dialogue on social media. we use spanish, greek, german, and u.k. candidates' tweets sent during the run-up to the recent european parliament elections, and rely on automated text analysis and machine learning methods to measure their level of civility. our contribution is an actor-oriented theory of political dialogue that incorporates twitter's specific affordances, clarifying how and why twitter's democratic promise may be limited.
",J,"Theocharis, Y; Barbera, P; Fazekas, Z; Popa, SA; Parnet, O",NA,NA,NA,"Theocharis, Yannis; Barbera, Pablo; Fazekas, Zoltan; Popa, Sebastian Adrian; Parnet, Olivier",NA,NA,A Bad Workman Blames His Tweets: The Consequences of Citizens' Uncivil Twitter Use When Interacting With Party Candidates,JOURNAL OF COMMUNICATION,NA,NA,English,Article,NA,NA,NA,NA,NA,Political Communication; Machine Learning; Social Media; Twitter; Civility; Politeness; Automated Text Analysis,ONLINE; INCIVILITY; CAMPAIGN; PATTERNS; FACEBOOK; COMMUNICATION; POLITICS; TOOLS; TALK,"Existing studies focusing on politicians' adoption of Twitter have found that they use it primarily as a broadcasting tool. We argue that citizens' impolite and/or uncivil behavior is one possible explanation for such decisions. Social media conversations are rife with harassment and politicians are a prime target. This alters the incentive structure of engaging in dialogue on social media. We use Spanish, Greek, German, and U.K. candidates' tweets sent during the run-up to the recent European Parliament elections, and rely on automated text analysis and machine learning methods to measure their level of civility. Our contribution is an actor-oriented theory of political dialogue that incorporates Twitter's specific affordances, clarifying how and why Twitter's democratic promise may be limited.","[Theocharis, Yannis; Popa, Sebastian Adrian] Univ Mannheim, Mannheim Ctr European Social Res, D-68159 Mannheim, Germany; [Barbera, Pablo] Univ Calif Los Angeles, Sch Int Relat, Los Angeles, CA 90089 USA; [Fazekas, Zoltan] Univ Oslo, Dept Polit Sci, N-0317 Oslo, Norway; [Parnet, Olivier] Kantar Publ, B-1160 Brussels, Belgium",NA,"Theocharis, Y (corresponding author), Univ Mannheim, Mannheim Ctr European Social Res, D-68159 Mannheim, Germany.",yannis.theocharis@uni-mannheim.de,"Barber, Pablo/G-1893-2016; Theocharis, Yannis/Q-8336-2019","Barber, Pablo/0000-0002-9063-4829; Theocharis, Yannis/0000-0001-7209-9669",Gordon and Betty Moore Foundation; Alfred P. Sloan Foundation,Gordon and Betty Moore Foundation(Gordon and Betty Moore Foundation); Alfred P. Sloan Foundation(Alfred P. Sloan Foundation),"The authors would like to thank Laura Sudulich and Michael Jensen for reading and commenting on earlier versions of this manuscript presented at the 2015 European Political Science Association conference and the 2015 Annual Meeting of the American Political Science Association respectively. The authors are also grateful to the Editor of the journal and the three anonymous reviewers for their thoughtful suggestions. Pablo Barbera gratefully acknowledges financial support from the Gordon and Betty Moore Foundation and the Alfred P. Sloan Foundation. Finally, the authors are grateful to the committee of the American Political Science Association's Information Technology and Politics Section, which honoured this manuscript with the 2015 Best Conference Paper in Information Technology and Politics Award.",NA,70,70,70,2,76,OXFORD UNIV PRESS INC,CARY,"JOURNALS DEPT, 2001 EVANS RD, CARY, NC 27513 USA",0021-9916,1460-2466,NA,J COMMUN,J. Commun.,DEC,2016,66,6,NA,NA,NA,NA,1007,1031,NA,10.1111/jcom.12259,http://dx.doi.org/10.1111/jcom.12259,NA,NA,25,Communication,Social Science Citation Index (SSCI),Communication,EJ3QS,NA,Green Accepted,NA,NA,2022-07-01,WOS:000393127300012,View Full Record in Web of Science,"existing studies focusing on politicians' adoption of twitter have found that they use it primarily as a broadcasting tool. we argue that citizens' impolite and/or uncivil behavior is one possible explanation for such decisions. social media conversations are rife with harassment and politicians are a prime target. this alters the incentive structure of engaging in dialogue on social media. we use spanish, greek, german, and u.k. candidates' tweets sent during the run-up to the recent european parliament elections, and rely on automated text analysis and machine learning methods to measure their level of civility. our contribution is an actor-oriented theory of political dialogue that incorporates twitter's specific affordances, clarifying how and why twitter's democratic promise may be limited."
"In text, images, merged surveys, voter files, and elsewhere, data sets are often missing important covariates, either because they are latent features of observations (such as sentiment in text) or because they are not collected (such as race in voter files). One promising approach for coping with this missing data is to find the true values of the missing covariates for a subset of the observations and then train a machine learning algorithm to predict the values of those covariates for the rest. However, plugging in these predictions without regard for prediction error renders regression analyses biased, inconsistent, and overconfident. We characterize the severity of the problem posed by prediction error, describe a procedure to avoid these inconsistencies under comparatively general assumptions, and demonstrate the performance of our estimators through simulations and a study of hostile political dialogue on the Internet. We provide software implementing our approach.
",0,"in text, images, merged surveys, voter files, and elsewhere, data sets are often missing important covariates, either because they are latent features of observations (such as sentiment in text) or because they are not collected (such as race in voter files). one promising approach for coping with this missing data is to find the true values of the missing covariates for a subset of the observations and then train a machine learning algorithm to predict the values of those covariates for the rest. however, plugging in these predictions without regard for prediction error renders regression analyses biased, inconsistent, and overconfident. we characterize the severity of the problem posed by prediction error, describe a procedure to avoid these inconsistencies under comparatively general assumptions, and demonstrate the performance of our estimators through simulations and a study of hostile political dialogue on the internet. we provide software implementing our approach.
",J,"Fong, C; Tyler, M",NA,NA,NA,"Fong, Christian; Tyler, Matthew",NA,NA,Machine Learning Predictions as Regression Covariates,POLITICAL ANALYSIS,NA,NA,English,Article,NA,NA,NA,NA,NA,machine learning; classification; inference; instrumental variables,NA,"In text, images, merged surveys, voter files, and elsewhere, data sets are often missing important covariates, either because they are latent features of observations (such as sentiment in text) or because they are not collected (such as race in voter files). One promising approach for coping with this missing data is to find the true values of the missing covariates for a subset of the observations and then train a machine learning algorithm to predict the values of those covariates for the rest. However, plugging in these predictions without regard for prediction error renders regression analyses biased, inconsistent, and overconfident. We characterize the severity of the problem posed by prediction error, describe a procedure to avoid these inconsistencies under comparatively general assumptions, and demonstrate the performance of our estimators through simulations and a study of hostile political dialogue on the Internet. We provide software implementing our approach.","[Fong, Christian] Univ Michigan, Dept Polit Sci, Ann Arbor, MI 48109 USA; [Tyler, Matthew] Stanford Univ, Dept Polit Sci, Stanford, CA 94305 USA",NA,"Fong, C (corresponding author), Univ Michigan, Dept Polit Sci, Ann Arbor, MI 48109 USA.",cjfong@umich.edu; mdtyler@stanford.edu,NA,"Tyler, Matthew/0000-0001-8977-6603",NA,NA,NA,NA,23,3,3,3,3,CAMBRIDGE UNIV PRESS,CAMBRIDGE,"EDINBURGH BLDG, SHAFTESBURY RD, CB2 8RU CAMBRIDGE, ENGLAND",1047-1987,1476-4989,NA,POLIT ANAL,Polit. Anal.,OCT,2021,29,4,NA,NA,NA,NA,467,484,PII S1047198720000388,10.1017/pan.2020.38,http://dx.doi.org/10.1017/pan.2020.38,NA,NA,18,Political Science,Social Science Citation Index (SSCI),Government & Law,UQ7UA,NA,NA,NA,NA,2022-07-01,WOS:000696264700005,View Full Record in Web of Science,"in text, images, merged surveys, voter files, and elsewhere, data sets are often missing important covariates, either because they are latent features of observations (such as sentiment in text) or because they are not collected (such as race in voter files). one promising approach for coping with this missing data is to find the true values of the missing covariates for a subset of the observations and then train a machine learning algorithm to predict the values of those covariates for the rest. however, plugging in these predictions without regard for prediction error renders regression analyses biased, inconsistent, and overconfident. we characterize the severity of the problem posed by prediction error, describe a procedure to avoid these inconsistencies under comparatively general assumptions, and demonstrate the performance of our estimators through simulations and a study of hostile political dialogue on the internet. we provide software implementing our approach."
