"The analysis of political texts from parliamentary speeches, party manifestos, social media, or press releases forms the basis of major and growing fields in political science, not least since advances in text-as-data methods have rendered the analysis of large text corpora straightforward. However, a lot of sources of political speech are not regularly transcribed, and their on-demand transcription by humans is prohibitively expensive for research purposes. This class includes political speech in certain legislatures, during political party conferences as well as television interviews and talk shows. We showcase how scholars can use automatic speech recognition systems to analyze such speech with quantitative text analysis models of the bag-of-words variety. To probe results for robustness to transcription error, we present an original word error rate simulation (WERSIM) procedure implemented in
   . We demonstrate the potential of automatic speech recognition to address open questions in political science with two substantive applications and discuss its limitations and practical challenges.
",1,"the analysis of political texts from parliamentary speeches, party manifestos, social media, or press releases forms the basis of major and growing fields in political science, not least since advances in text-as-data methods have rendered the analysis of large text corpora straightforward. however, a lot of sources of political speech are not regularly transcribed, and their on-demand transcription by humans is prohibitively expensive for research purposes. this class includes political speech in certain legislatures, during political party conferences as well as television interviews and talk shows. we showcase how scholars can use automatic speech recognition systems to analyze such speech with quantitative text analysis models of the bag-of-words variety. to probe results for robustness to transcription error, we present an original word error rate simulation (wersim) procedure implemented in
   . we demonstrate the potential of automatic speech recognition to address open questions in political science with two substantive applications and discuss its limitations and practical challenges.
",J,"Proksch, SO; Wratil, C; Wackerle, J",NA,NA,NA,"Proksch, Sven-Oliver; Wratil, Christopher; Waeckerle, Jens",NA,NA,Testing the Validity of Automatic Speech Recognition for Political Text Analysis,POLITICAL ANALYSIS,NA,NA,English,Article,NA,NA,NA,NA,NA,Google; YouTube; text analysis; transcriptions; automatic speech recognition; campaigns,BARGAINING POWER; ELECTION; POSITIONS; SENTIMENT; WORDS; MODEL; NEWS; VOTE,"The analysis of political texts from parliamentary speeches, party manifestos, social media, or press releases forms the basis of major and growing fields in political science, not least since advances in text-as-data methods have rendered the analysis of large text corpora straightforward. However, a lot of sources of political speech are not regularly transcribed, and their on-demand transcription by humans is prohibitively expensive for research purposes. This class includes political speech in certain legislatures, during political party conferences as well as television interviews and talk shows. We showcase how scholars can use automatic speech recognition systems to analyze such speech with quantitative text analysis models of the bag-of-words variety. To probe results for robustness to transcription error, we present an original word error rate simulation (WERSIM) procedure implemented in . We demonstrate the potential of automatic speech recognition to address open questions in political science with two substantive applications and discuss its limitations and practical challenges.","[Proksch, Sven-Oliver; Wratil, Christopher; Waeckerle, Jens] Univ Cologne, Cologne Ctr Comparat Polit, Cologne, Germany; [Wratil, Christopher] Harvard Univ, Minda de Gunzburg Ctr European Studies, Cambridge, MA 02138 USA",NA,"Proksch, SO (corresponding author), Univ Cologne, Cologne Ctr Comparat Polit, Cologne, Germany.",so.proksch@uni-koeln.de,"Proksch, Sven-Oliver/AAA-9584-2020; Wckerle, Jens/ABA-9169-2020","Proksch, Sven-Oliver/0000-0002-6130-6498; Wckerle, Jens/0000-0002-5108-7711; Wratil, Christopher/0000-0002-7339-9628",Fritz Thyssen Stiffung [20.16.0.045WW],Fritz Thyssen Stiffung,"We are grateful to Leonie Diffene, Felix Reich and Pit Rieger for their excellent research assistance. We are also very thankful for helpful comments on earlier versions of this work by two anonymous reviewers as well as Jeff Gill. Christopher Wratil would like to acknowledge funding by the Fritz Thyssen Stiffung (20.16.0.045WW). All remaining errors are our own. The replication files for this article are available on the Political Analysis Dataverse (Proksch, Wratil, and Wackerle 2018).",NA,56,4,4,5,13,CAMBRIDGE UNIV PRESS,CAMBRIDGE,"EDINBURGH BLDG, SHAFTESBURY RD, CB2 8RU CAMBRIDGE, ENGLAND",1047-1987,1476-4989,NA,POLIT ANAL,Polit. Anal.,JUL,2019,27,3,NA,NA,NA,NA,339,359,NA,10.1017/pan.2018.62,http://dx.doi.org/10.1017/pan.2018.62,NA,NA,21,Political Science,Social Science Citation Index (SSCI),Government & Law,IJ1VU,NA,NA,NA,NA,2022-07-01,WOS:000475687800005,View Full Record in Web of Science,"the analysis of political texts from parliamentary speeches, party manifestos, social media, or press releases forms the basis of major and growing fields in political science, not least since advances in text-as-data methods have rendered the analysis of large text corpora straightforward. however, a lot of sources of political speech are not regularly transcribed, and their on-demand transcription by humans is prohibitively expensive for research purposes. this class includes political speech in certain legislatures, during political party conferences as well as television interviews and talk shows. we showcase how scholars can use automatic speech recognition systems to analyze such speech with quantitative text analysis models of the bag-of-words variety. to probe results for robustness to transcription error, we present an original word error rate simulation (wersim) procedure implemented in . we demonstrate the potential of automatic speech recognition to address open questions in political science with two substantive applications and discuss its limitations and practical challenges."
"Social sciences are facing a crisis of replicability, and concerns about the confidence in quantitative findings have resulted in an increasing interest in open science practices across many fields. In this article we introduce scholars of (digital) journalism studies and communication science to multiverse analysis while addressing the possible reasons of heterogeneity in the findings of research on engagement with news on social media. Using the question of which news article characteristics predict news engagement on social media, this illustration of the multiverse approach shows how different measurement, data processing, and modelling choices lead to divergent conclusions. In particular, we show how the selection of widely used automated text analysis tools and preprocessing steps influence the conclusions drawn from the analysis. We also use this illustration to guide interested scholars through the different steps of doing a multiverse analysis. More broadly, we demonstrate how multiverse analysis can be an open and transparent research approach in a field that is increasingly faced with a wide range of analytical choices.
",0,"social sciences are facing a crisis of replicability, and concerns about the confidence in quantitative findings have resulted in an increasing interest in open science practices across many fields. in this article we introduce scholars of (digital) journalism studies and communication science to multiverse analysis while addressing the possible reasons of heterogeneity in the findings of research on engagement with news on social media. using the question of which news article characteristics predict news engagement on social media, this illustration of the multiverse approach shows how different measurement, data processing, and modelling choices lead to divergent conclusions. in particular, we show how the selection of widely used automated text analysis tools and preprocessing steps influence the conclusions drawn from the analysis. we also use this illustration to guide interested scholars through the different steps of doing a multiverse analysis. more broadly, we demonstrate how multiverse analysis can be an open and transparent research approach in a field that is increasingly faced with a wide range of analytical choices.
",J,"Pipal, C; Song, H; Boomgaarden, HG",NA,NA,NA,"Pipal, Christian; Song, Hyunjin; Boomgaarden, Hajo G.",NA,NA,"If You Have Choices, Why Not Choose (and Share) All of Them? A Multiverse Approach to Understanding News Engagement on Social Media",DIGITAL JOURNALISM,NA,NA,English,Article; Early Access,NA,NA,NA,NA,NA,Multiverse analysis; online news engagement; news values; open science; text analysis; sentiment analysis,QUESTIONABLE RESEARCH PRACTICES; COMMUNICATION; TEXT; OPPORTUNITIES; SENTIMENT; PITFALLS; ME,"Social sciences are facing a crisis of replicability, and concerns about the confidence in quantitative findings have resulted in an increasing interest in open science practices across many fields. In this article we introduce scholars of (digital) journalism studies and communication science to multiverse analysis while addressing the possible reasons of heterogeneity in the findings of research on engagement with news on social media. Using the question of which news article characteristics predict news engagement on social media, this illustration of the multiverse approach shows how different measurement, data processing, and modelling choices lead to divergent conclusions. In particular, we show how the selection of widely used automated text analysis tools and preprocessing steps influence the conclusions drawn from the analysis. We also use this illustration to guide interested scholars through the different steps of doing a multiverse analysis. More broadly, we demonstrate how multiverse analysis can be an open and transparent research approach in a field that is increasingly faced with a wide range of analytical choices.","[Pipal, Christian] Univ Amsterdam, Dept Polit Sci, Amsterdam, Netherlands; [Song, Hyunjin] Yonsei Univ, Dept Commun, Seoul, South Korea; [Boomgaarden, Hajo G.] Univ Vienna, Dept Commun, Vienna, Austria",NA,"Pipal, C (corresponding author), Univ Amsterdam, Dept Polit Sci, Amsterdam, Netherlands.",c.pipal@uva.nl,"Pipal, Christian/ABY-0629-2022","Boomgaarden, Hajo G./0000-0002-5260-1284; Pipal, Christian/0000-0002-5395-2035",European Research Council (ERC) under the European Union's Horizon 2020 research and innovation programme [759079],European Research Council (ERC) under the European Union's Horizon 2020 research and innovation programme(European Research Council (ERC)),"unding Christian Pipal received funding from the European Research Council (ERC) under the European Union's Horizon 2020 research and innovation programme under grant agreement No 759079, POLEMIC.",NA,66,0,0,7,7,"ROUTLEDGE JOURNALS, TAYLOR & FRANCIS LTD",ABINGDON,"2-4 PARK SQUARE, MILTON PARK, ABINGDON OX14 4RN, OXON, ENGLAND",2167-0811,2167-082X,NA,DIGIT JOURNAL,Digit. Journal.,NA,NA,NA,NA,NA,NA,NA,NA,NA,NA,NA,10.1080/21670811.2022.2036623,http://dx.doi.org/10.1080/21670811.2022.2036623,NA,FEB 2022,21,Communication,Social Science Citation Index (SSCI),Communication,ZK9YJ,NA,hybrid,NA,NA,2022-07-01,WOS:000763337300001,View Full Record in Web of Science,"social sciences are facing a crisis of replicability, and concerns about the confidence in quantitative findings have resulted in an increasing interest in open science practices across many fields. in this article we introduce scholars of (digital) journalism studies and communication science to multiverse analysis while addressing the possible reasons of heterogeneity in the findings of research on engagement with news on social media. using the question of which news article characteristics predict news engagement on social media, this illustration of the multiverse approach shows how different measurement, data processing, and modelling choices lead to divergent conclusions. in particular, we show how the selection of widely used automated text analysis tools and preprocessing steps influence the conclusions drawn from the analysis. we also use this illustration to guide interested scholars through the different steps of doing a multiverse analysis. more broadly, we demonstrate how multiverse analysis can be an open and transparent research approach in a field that is increasingly faced with a wide range of analytical choices."
"How accurate are survey-based measures of social media use, in particular about political topics? We answer this question by linking original survey data collected during the U.S. 2016 election campaign with respondents' observed social media activity. We use supervised machine learning to classify whether these Twitter and Facebook account data are content related to politics. We then benchmark our survey measures on frequency of posting about politics and the number of political figures followed. We find that, on average, our self-reported survey measures tend to correlate with observed social media activity. At the same time, we also find a worrying amount of individual-level discrepancy and problems related to extreme outliers. Our recommendations are twofold. The first is for survey questions about social media use to provide respondents with options covering a wider range of activity, especially in the long tail. The second is for survey questions to include specific content and anchors defining what it means for a post to be about politics.
",1,"how accurate are survey-based measures of social media use, in particular about political topics? we answer this question by linking original survey data collected during the u.s. 2016 election campaign with respondents' observed social media activity. we use supervised machine learning to classify whether these twitter and facebook account data are content related to politics. we then benchmark our survey measures on frequency of posting about politics and the number of political figures followed. we find that, on average, our self-reported survey measures tend to correlate with observed social media activity. at the same time, we also find a worrying amount of individual-level discrepancy and problems related to extreme outliers. our recommendations are twofold. the first is for survey questions about social media use to provide respondents with options covering a wider range of activity, especially in the long tail. the second is for survey questions to include specific content and anchors defining what it means for a post to be about politics.
",J,"Guess, A; Munger, K; Nagler, J; Tucker, J",NA,NA,NA,"Guess, Andrew; Munger, Kevin; Nagler, Jonathan; Tucker, Joshua",NA,NA,How Accurate Are Survey Responses on Social Media and Politics?,POLITICAL COMMUNICATION,NA,NA,English,Article,NA,NA,NA,NA,NA,social media; media effects; survey measurement,COMMUNICATION; PERFORMANCE,"How accurate are survey-based measures of social media use, in particular about political topics? We answer this question by linking original survey data collected during the U.S. 2016 election campaign with respondents' observed social media activity. We use supervised machine learning to classify whether these Twitter and Facebook account data are content related to politics. We then benchmark our survey measures on frequency of posting about politics and the number of political figures followed. We find that, on average, our self-reported survey measures tend to correlate with observed social media activity. At the same time, we also find a worrying amount of individual-level discrepancy and problems related to extreme outliers. Our recommendations are twofold. The first is for survey questions about social media use to provide respondents with options covering a wider range of activity, especially in the long tail. The second is for survey questions to include specific content and anchors defining what it means for a post to be about politics.","[Guess, Andrew] Princeton Univ, Polit & Publ Affairs, Princeton, NJ 08544 USA; [Munger, Kevin] Princeton Univ, Ctr Study Democrat Polit, Princeton, NJ 08544 USA; [Nagler, Jonathan; Tucker, Joshua] NYU, Polit, New York, NY 10003 USA; [Nagler, Jonathan; Tucker, Joshua] NYU, Social Media & Polit Participat SMaPP Lab, New York, NY 10003 USA",NA,"Guess, A (corresponding author), Princeton Univ, Dept Polit, 213 Fisher Hall, Princeton, NJ 08544 USA.",aguess@princeton.edu,"Guess, Andrew/J-4904-2019","Guess, Andrew/0000-0003-2974-7848",INSPIRE program of the National Science Foundation [SES-1248077],INSPIRE program of the National Science Foundation,"This study has been approved by the New York University Institutional Review Board (IRB-12-9058, IRB-FY2017-150). We are grateful to Samantha Luks at YouGov for facilitating survey data collection, Yvan Scher for research assistance, and Jona Ronen for development and technical assistance. Thanks to Rachel Gibson, workshop participants at the University of Manchester, the editors of this special issue, and to three anonymous reviewers for their helpful comments and feedback. This research was supported by the INSPIRE program of the National Science Foundation (Award SES-1248077).",NA,31,39,39,6,22,TAYLOR & FRANCIS INC,PHILADELPHIA,"530 WALNUT STREET, STE 850, PHILADELPHIA, PA 19106 USA",1058-4609,1091-7675,NA,POLIT COMMUN,Polit. Commun.,APR 3,2019,36,2,NA,NA,NA,NA,241,258,NA,10.1080/10584609.2018.1504840,http://dx.doi.org/10.1080/10584609.2018.1504840,NA,NA,18,Communication; Political Science,Social Science Citation Index (SSCI),Communication; Government & Law,IS7SZ,NA,NA,NA,NA,2022-07-01,WOS:000482350900004,View Full Record in Web of Science,"how accurate are survey-based measures of social media use, in particular about political topics? we answer this question by linking original survey data collected during the u.s. 2016 election campaign with respondents' observed social media activity. we use supervised machine learning to classify whether these twitter and facebook account data are content related to politics. we then benchmark our survey measures on frequency of posting about politics and the number of political figures followed. we find that, on average, our self-reported survey measures tend to correlate with observed social media activity. at the same time, we also find a worrying amount of individual-level discrepancy and problems related to extreme outliers. our recommendations are twofold. the first is for survey questions about social media use to provide respondents with options covering a wider range of activity, especially in the long tail. the second is for survey questions to include specific content and anchors defining what it means for a post to be about politics."
"Scholars are increasingly utilizing online workforces to encode latent political concepts embedded in written or spoken records. In this letter, we build on past efforts by developing and validating a crowdsourced pairwise comparison framework for encoding political texts that combines the human ability to understand natural language with the ability of computers to aggregate data into reliable measures while ameliorating concerns about the biases and unreliability of non-expert human coders. We validate the method with advertisements for U.S. Senate candidates and with State Department reports on human rights. The framework we present is very general, and we provide free software to help applied researchers interact easily with online workforces to extract meaningful measures from texts.
",1,"scholars are increasingly utilizing online workforces to encode latent political concepts embedded in written or spoken records. in this letter, we build on past efforts by developing and validating a crowdsourced pairwise comparison framework for encoding political texts that combines the human ability to understand natural language with the ability of computers to aggregate data into reliable measures while ameliorating concerns about the biases and unreliability of non-expert human coders. we validate the method with advertisements for u.s. senate candidates and with state department reports on human rights. the framework we present is very general, and we provide free software to help applied researchers interact easily with online workforces to extract meaningful measures from texts.
",J,"Carlson, D; Montgomery, JM",NA,NA,NA,"Carlson, David; Montgomery, Jacob M.",NA,NA,"A Pairwise Comparison Framework for Fast, Flexible, and Reliable Human Coding of Political Texts",AMERICAN POLITICAL SCIENCE REVIEW,NA,NA,English,Article,NA,NA,NA,NA,NA,NA,HUMAN-RIGHTS; TREATIES,"Scholars are increasingly utilizing online workforces to encode latent political concepts embedded in written or spoken records. In this letter, we build on past efforts by developing and validating a crowdsourced pairwise comparison framework for encoding political texts that combines the human ability to understand natural language with the ability of computers to aggregate data into reliable measures while ameliorating concerns about the biases and unreliability of non-expert human coders. We validate the method with advertisements for U.S. Senate candidates and with State Department reports on human rights. The framework we present is very general, and we provide free software to help applied researchers interact easily with online workforces to extract meaningful measures from texts.","[Carlson, David; Montgomery, Jacob M.] Washington Univ, Dept Polit Sci, Campus Box 1063,One Brookings Dr, St Louis, MO 63130 USA",NA,"Carlson, D (corresponding author), Washington Univ, Dept Polit Sci, Campus Box 1063,One Brookings Dr, St Louis, MO 63130 USA.",carlson.david@wustl.edu; jacob.montgomery@wustl.edu,NA,NA,"Weidenbaum Center on the Economy, Government, and Public Policy","Weidenbaum Center on the Economy, Government, and Public Policy","We thank Burt Monroe, John Freeman, and Brandon Stewart for providing comments on a previous version of this paper. We are indebted to Ryden Butler, Dominic Jarkey, Jon Rogowski, Erin Rossiter, and Michelle Torres for their assistance with this project. We particularly wish to thank Matt Dickenson for his programming assistance. We also appreciate the assistance in the R package development from David Flasterstein, Joseph Ludmir, and Taishi Muraoka. We are grateful for the financial support provided by the Weidenbaum Center on the Economy, Government, and Public Policy. Finally, we wish to thank the partner-workers at Amazon's Mechanical Turk who make this research possible.",NA,11,13,13,0,9,CAMBRIDGE UNIV PRESS,NEW YORK,"32 AVENUE OF THE AMERICAS, NEW YORK, NY 10013-2473 USA",0003-0554,1537-5943,NA,AM POLIT SCI REV,Am. Polit. Sci. Rev.,NOV,2017,111,4,NA,NA,NA,NA,835,843,NA,10.1017/S0003055417000302,http://dx.doi.org/10.1017/S0003055417000302,NA,NA,9,Political Science,Social Science Citation Index (SSCI),Government & Law,FL1LY,NA,NA,NA,NA,2022-07-01,WOS:000413977600014,View Full Record in Web of Science,"scholars are increasingly utilizing online workforces to encode latent political concepts embedded in written or spoken records. in this letter, we build on past efforts by developing and validating a crowdsourced pairwise comparison framework for encoding political texts that combines the human ability to understand natural language with the ability of computers to aggregate data into reliable measures while ameliorating concerns about the biases and unreliability of non-expert human coders. we validate the method with advertisements for u.s. senate candidates and with state department reports on human rights. the framework we present is very general, and we provide free software to help applied researchers interact easily with online workforces to extract meaningful measures from texts."
