abstract,code,abstract_join.x,Publication Type,Authors,Book Authors,Book Editors,Book Group Authors,Author Full Names,Book Author Full Names,Group Authors,Article Title,Source Title,Book Series Title,Book Series Subtitle,Language,Document Type,Conference Title,Conference Date,Conference Location,Conference Sponsor,Conference Host,Author Keywords,Keywords Plus,Abstract,Addresses,Affiliations,Reprint Addresses,Email Addresses,Researcher Ids,ORCIDs,Funding Orgs,Funding Name Preferred,Funding Text,Cited References,Cited Reference Count,"Times Cited, WoS Core","Times Cited, All Databases",180 Day Usage Count,Since 2013 Usage Count,Publisher,Publisher City,Publisher Address,ISSN,eISSN,ISBN,Journal Abbreviation,Journal ISO Abbreviation,Publication Date,Publication Year,Volume,Issue,Part Number,Supplement,Special Issue,Meeting Abstract,Start Page,End Page,Article Number,DOI,DOI Link,Book DOI,Early Access Date,Number of Pages,WoS Categories,Web of Science Index,Research Areas,IDS Number,Pubmed Id,Open Access Designations,Highly Cited Status,Hot Paper Status,Date of Export,UT (Unique WOS ID),Web of Science Record,abstract_join.y
"This study explores the ways in which global press freedom watchdogs have discursively constructed the issue of press freedom during the Covid-19 pandemic. Drawing on a multimodal discourse analysis, the study examines web stories and Tweets posted by the International Press Institute (IPI), the Committee to Protect Journalists (CPJ), and Reporters sans Frontieres (RSF), with the purpose of answering three primary questions: (1) Who or what do the CPJ, the IPI, and RSF represent as the greatest threat to press freedom in relation to Covid-19? (2) What are the differences between these groups' representations of press freedom in their own regions of the world and their representations of press freedom in 'Other' places? (3) What digital strategies do the IPI, CPJ, and RSF use in coverage of the Covid-19 pandemic? The article ultimately seeks to understand the ways in which each of these influential press freedom groups help to popularize particular understandings of press freedom in the 21st century.
",1,"this study explores the ways in which global press freedom watchdogs have discursively constructed the issue of press freedom during the covid-19 pandemic. drawing on a multimodal discourse analysis, the study examines web stories and tweets posted by the international press institute (ipi), the committee to protect journalists (cpj), and reporters sans frontieres (rsf), with the purpose of answering three primary questions: (1) who or what do the cpj, the ipi, and rsf represent as the greatest threat to press freedom in relation to covid-19? (2) what are the differences between these groups' representations of press freedom in their own regions of the world and their representations of press freedom in 'other' places? (3) what digital strategies do the ipi, cpj, and rsf use in coverage of the covid-19 pandemic? the article ultimately seeks to understand the ways in which each of these influential press freedom groups help to popularize particular understandings of press freedom in the 21st century.
",J,"Palmer, L",NA,NA,NA,"Palmer, Lindsay",NA,NA,"Press Freedom during Covid-19: The Digital Discourses of the International Press Institute, Reporters Sans Frontieres, and the Committee to Protect Journalists",DIGITAL JOURNALISM,NA,NA,English,Article; Early Access,NA,NA,NA,NA,NA,Covid-19; pandemic; coronavirus; press freedom; Committee to Protect Journalists; International Press Institute; Reporters sans Frontieres; Twitter,MEDIA; COMMUNICATION; NEWS,"This study explores the ways in which global press freedom watchdogs have discursively constructed the issue of press freedom during the Covid-19 pandemic. Drawing on a multimodal discourse analysis, the study examines web stories and Tweets posted by the International Press Institute (IPI), the Committee to Protect Journalists (CPJ), and Reporters sans Frontieres (RSF), with the purpose of answering three primary questions: (1) Who or what do the CPJ, the IPI, and RSF represent as the greatest threat to press freedom in relation to Covid-19? (2) What are the differences between these groups' representations of press freedom in their own regions of the world and their representations of press freedom in Other places? (3) What digital strategies do the IPI, CPJ, and RSF use in coverage of the Covid-19 pandemic? The article ultimately seeks to understand the ways in which each of these influential press freedom groups help to popularize particular understandings of press freedom in the 21st century.","[Palmer, Lindsay] Univ Wisconsin, Sch Journalism & Mass Commun, Madison, WI 53706 USA",NA,"Palmer, L (corresponding author), Univ Wisconsin, Sch Journalism & Mass Commun, Madison, WI 53706 USA.",lindsay.palmer@wisc.edu,NA,NA,NA,NA,NA,NA,62,0,0,5,7,"ROUTLEDGE JOURNALS, TAYLOR & FRANCIS LTD",ABINGDON,"2-4 PARK SQUARE, MILTON PARK, ABINGDON OX14 4RN, OXON, ENGLAND",2167-0811,2167-082X,NA,DIGIT JOURNAL,Digit. Journal.,NA,NA,NA,NA,NA,NA,NA,NA,NA,NA,NA,10.1080/21670811.2021.1943480,http://dx.doi.org/10.1080/21670811.2021.1943480,NA,SEP 2021,19,Communication,Social Science Citation Index (SSCI),Communication,WK9JZ,NA,NA,NA,NA,2022-07-01,WOS:000710036400001,View Full Record in Web of Science,"this study explores the ways in which global press freedom watchdogs have discursively constructed the issue of press freedom during the covid-19 pandemic. drawing on a multimodal discourse analysis, the study examines web stories and tweets posted by the international press institute (ipi), the committee to protect journalists (cpj), and reporters sans frontieres (rsf), with the purpose of answering three primary questions: (1) who or what do the cpj, the ipi, and rsf represent as the greatest threat to press freedom in relation to covid-19? (2) what are the differences between these groups' representations of press freedom in their own regions of the world and their representations of press freedom in other places? (3) what digital strategies do the ipi, cpj, and rsf use in coverage of the covid-19 pandemic? the article ultimately seeks to understand the ways in which each of these influential press freedom groups help to popularize particular understandings of press freedom in the 21st century."
"This article investigates how the mix of attributes present across different media shapes perceptions of incivility. I argue that certain modalities, particularly the channel and structure of a media platform, facilitate the perception of media as more uncivil even if the content is kept the same. To test this argument, I conduct two survey experiments in which participants are randomly assigned to treatments in which the substantive content and text remains the same but is packaged to mimic different media types. Generally, audio and video increase awareness of incivility cues as well as participants' evaluations of negative, emotional, and entertaining tone. There are also differences in the extent to which individuals notice incivility on Twitter than on other text-based media platforms. The social media platform is also particularly entertaining in comparison to the other platforms studied. This article demonstrates that media attributes interact to shape our understanding and identification of uncivil language. Furthermore, it suggests that more attention should be focused on identifying the different sets of characteristics that make incivility more or less likely or salient in political media.
",1,"this article investigates how the mix of attributes present across different media shapes perceptions of incivility. i argue that certain modalities, particularly the channel and structure of a media platform, facilitate the perception of media as more uncivil even if the content is kept the same. to test this argument, i conduct two survey experiments in which participants are randomly assigned to treatments in which the substantive content and text remains the same but is packaged to mimic different media types. generally, audio and video increase awareness of incivility cues as well as participants' evaluations of negative, emotional, and entertaining tone. there are also differences in the extent to which individuals notice incivility on twitter than on other text-based media platforms. the social media platform is also particularly entertaining in comparison to the other platforms studied. this article demonstrates that media attributes interact to shape our understanding and identification of uncivil language. furthermore, it suggests that more attention should be focused on identifying the different sets of characteristics that make incivility more or less likely or salient in political media.
",J,"Sydnor, E",NA,NA,NA,"Sydnor, Emily",NA,NA,Platforms for Incivility: Examining Perceptions Across Different Media Formats,POLITICAL COMMUNICATION,NA,NA,English,Article,NA,NA,NA,NA,NA,hybridity; incivility; media platforms; mix of attributes theory; perceptions,ONLINE,"This article investigates how the mix of attributes present across different media shapes perceptions of incivility. I argue that certain modalities, particularly the channel and structure of a media platform, facilitate the perception of media as more uncivil even if the content is kept the same. To test this argument, I conduct two survey experiments in which participants are randomly assigned to treatments in which the substantive content and text remains the same but is packaged to mimic different media types. Generally, audio and video increase awareness of incivility cues as well as participants' evaluations of negative, emotional, and entertaining tone. There are also differences in the extent to which individuals notice incivility on Twitter than on other text-based media platforms. The social media platform is also particularly entertaining in comparison to the other platforms studied. This article demonstrates that media attributes interact to shape our understanding and identification of uncivil language. Furthermore, it suggests that more attention should be focused on identifying the different sets of characteristics that make incivility more or less likely or salient in political media.","[Sydnor, Emily] Southwestern Univ, Georgetown, TX USA",NA,"Sydnor, E (corresponding author), 1001 E Univ Ave, Georgetown, TX 78626 USA.",sydnore@southwestern.edu,NA,NA,Southwestern University; University of Virginia Political Psychology Working Group,Southwestern University; University of Virginia Political Psychology Working Group,The author would like to acknowledge Southwestern University and the University of Virginia Political Psychology Working Group for their financial support for this project.,NA,46,19,19,2,23,TAYLOR & FRANCIS INC,PHILADELPHIA,"530 WALNUT STREET, STE 850, PHILADELPHIA, PA 19106 USA",1058-4609,1091-7675,NA,POLIT COMMUN,Polit. Commun.,NA,2018,35,1,NA,NA,SI,NA,97,116,NA,10.1080/10584609.2017.1355857,http://dx.doi.org/10.1080/10584609.2017.1355857,NA,NA,20,Communication; Political Science,Social Science Citation Index (SSCI),Communication; Government & Law,FX1EJ,NA,NA,NA,NA,2022-07-01,WOS:000425791300006,View Full Record in Web of Science,"this article investigates how the mix of attributes present across different media shapes perceptions of incivility. i argue that certain modalities, particularly the channel and structure of a media platform, facilitate the perception of media as more uncivil even if the content is kept the same. to test this argument, i conduct two survey experiments in which participants are randomly assigned to treatments in which the substantive content and text remains the same but is packaged to mimic different media types. generally, audio and video increase awareness of incivility cues as well as participants' evaluations of negative, emotional, and entertaining tone. there are also differences in the extent to which individuals notice incivility on twitter than on other text-based media platforms. the social media platform is also particularly entertaining in comparison to the other platforms studied. this article demonstrates that media attributes interact to shape our understanding and identification of uncivil language. furthermore, it suggests that more attention should be focused on identifying the different sets of characteristics that make incivility more or less likely or salient in political media."
"The 2016US election and the victory of Donald Trump are closely connected to a perceived rise of the far-right in the United States. We build upon public sphere and alternative media theory to discuss the relevance of alternative media for the US (far-)right and whether the election period and the candidate Trump allowed far-right alternative media to establish themselves in the (far-) right networked public sphere. We investigate whether it has come to a convergence of topics between the right and the extreme far-right. We analyze the topics nine right-wing outlets, ranging from Fox News to the Neo-Nazi Daily Stormer, covered in 2015/2016 during the US presidential election. We show through topic modeling of 21,919 articles how Breitbart established itself as a media outlet between the extreme far-right and mainstream right by both covering more extreme and more classic conservative topics. We show through time series clustering how Breitbart and Fox News converged in their coverage of Islam and immigration. Finally, we show through hyperlink analysis that the connection between the far-right and the mainstream right is mostly one-sided; while the alternative outlets link to more established ones, the established outlets mostly ignore the outlets from the far-right.
",1,"the 2016us election and the victory of donald trump are closely connected to a perceived rise of the far-right in the united states. we build upon public sphere and alternative media theory to discuss the relevance of alternative media for the us (far-)right and whether the election period and the candidate trump allowed far-right alternative media to establish themselves in the (far-) right networked public sphere. we investigate whether it has come to a convergence of topics between the right and the extreme far-right. we analyze the topics nine right-wing outlets, ranging from fox news to the neo-nazi daily stormer, covered in 2015/2016 during the us presidential election. we show through topic modeling of 21,919 articles how breitbart established itself as a media outlet between the extreme far-right and mainstream right by both covering more extreme and more classic conservative topics. we show through time series clustering how breitbart and fox news converged in their coverage of islam and immigration. finally, we show through hyperlink analysis that the connection between the far-right and the mainstream right is mostly one-sided; while the alternative outlets link to more established ones, the established outlets mostly ignore the outlets from the far-right.
",J,"Kaiser, J; Rauchfleisch, A; Bourassa, N",NA,NA,NA,"Kaiser, Jonas; Rauchfleisch, Adrian; Bourassa, Nikki",NA,NA,Connecting the (Far-)Right Dots: A Topic Modeling and Hyperlink Analysis of (Far-)Right Media Coverage during the US Elections 2016,DIGITAL JOURNALISM,NA,NA,English,Article,NA,NA,NA,NA,NA,Networked public sphere; alternative media; far-right; topic modeling; election; alt-right,FAKE NEWS; ALTERNATIVE MEDIA; PUBLIC SPHERES; DISCOURSE; INTERNET,"The 2016US election and the victory of Donald Trump are closely connected to a perceived rise of the far-right in the United States. We build upon public sphere and alternative media theory to discuss the relevance of alternative media for the US (far-)right and whether the election period and the candidate Trump allowed far-right alternative media to establish themselves in the (far-) right networked public sphere. We investigate whether it has come to a convergence of topics between the right and the extreme far-right. We analyze the topics nine right-wing outlets, ranging from Fox News to the Neo-Nazi Daily Stormer, covered in 2015/2016 during the US presidential election. We show through topic modeling of 21,919 articles how Breitbart established itself as a media outlet between the extreme far-right and mainstream right by both covering more extreme and more classic conservative topics. We show through time series clustering how Breitbart and Fox News converged in their coverage of Islam and immigration. Finally, we show through hyperlink analysis that the connection between the far-right and the mainstream right is mostly one-sided; while the alternative outlets link to more established ones, the established outlets mostly ignore the outlets from the far-right.","[Kaiser, Jonas; Bourassa, Nikki] Harvard Univ, Berkman Klein Ctr Internet & Soc, Cambridge, MA 02138 USA; [Kaiser, Jonas] Alexander Humboldt Inst Internet & Soc, Berlin, Germany; [Rauchfleisch, Adrian] Natl Taiwan Univ, Grad Inst Journalism, Taipei, Taiwan",NA,"Kaiser, J (corresponding author), Harvard Univ, Berkman Klein Ctr Internet & Soc, Cambridge, MA 02138 USA.;Kaiser, J (corresponding author), Alexander Humboldt Inst Internet & Soc, Berlin, Germany.",j.kaiser@zeppelin-university.net,"Rauchfleisch, Adrian/AAK-4164-2020","RAUCHFLEISCH, ADRIAN/0000-0003-1232-083X",Deutsche Forschungsgemeinschaft [KA 4618/1-2],Deutsche Forschungsgemeinschaft(German Research Foundation (DFG)),This work was supported by Deutsche Forschungsgemeinschaft [KA 4618/1-2].,NA,46,18,18,3,15,"ROUTLEDGE JOURNALS, TAYLOR & FRANCIS LTD",ABINGDON,"2-4 PARK SQUARE, MILTON PARK, ABINGDON OX14 4RN, OXON, ENGLAND",2167-0811,2167-082X,NA,DIGIT JOURNAL,Digit. Journal.,MAR 15,2020,8,3,NA,NA,NA,NA,422,441,NA,10.1080/21670811.2019.1682629,http://dx.doi.org/10.1080/21670811.2019.1682629,NA,OCT 2019,20,Communication,Social Science Citation Index (SSCI),Communication,LP3TY,NA,NA,NA,NA,2022-07-01,WOS:000494422800001,View Full Record in Web of Science,"the 2016us election and the victory of donald trump are closely connected to a perceived rise of the far-right in the united states. we build upon public sphere and alternative media theory to discuss the relevance of alternative media for the us (far-)right and whether the election period and the candidate trump allowed far-right alternative media to establish themselves in the (far-) right networked public sphere. we investigate whether it has come to a convergence of topics between the right and the extreme far-right. we analyze the topics nine right-wing outlets, ranging from fox news to the neo-nazi daily stormer, covered in 2015/2016 during the us presidential election. we show through topic modeling of 21,919 articles how breitbart established itself as a media outlet between the extreme far-right and mainstream right by both covering more extreme and more classic conservative topics. we show through time series clustering how breitbart and fox news converged in their coverage of islam and immigration. finally, we show through hyperlink analysis that the connection between the far-right and the mainstream right is mostly one-sided; while the alternative outlets link to more established ones, the established outlets mostly ignore the outlets from the far-right."
